{
  "schemaVersion": 1,
  "updatedAt": "2026-09-15T08:32:36.000Z",
  "source": {
    "name": "USGS Earthquake Hazards Program",
    "url": "https://earthquake.usgs.gov/earthquakes/feed/v1.0/summary/all_day.geojson",
    "baselineUrl": "https://earthquake.usgs.gov/earthquakes/feed/v1.0/summary/all_week.geojson",
    "window": "past-24-hours",
    "baselineWindow": "previous-6-days"
  },
  "summary": {
    "total": 198,
    "m4Plus": 20,
    "m5Plus": 5,
    "shallowCount": 175,
    "medianDepthKm": 8.1,
    "strongestMagnitude": 5.6,
    "strongestEventId": "us7000thcs"
  },
  "baseline": {
    "days": 6,
    "dailyAverage": {
      "total": 354.2,
      "m4Plus": 17.3,
      "m5Plus": 3.3
    },
    "differenceFromAverage": {
      "total": -156.2,
      "m4Plus": 2.7,
      "m5Plus": 1.7
    }
  },
  "trends": {
    "magnitudeBands": [
      {
        "id": "under-3",
        "label": "Below M3",
        "count": 167
      },
      {
        "id": "m3",
        "label": "M3-3.9",
        "count": 11
      },
      {
        "id": "m4",
        "label": "M4-4.9",
        "count": 15
      },
      {
        "id": "m5-plus",
        "label": "M5+",
        "count": 5
      }
    ],
    "threeHourBuckets": [
      {
        "start": "2026-09-14T08:32:36.000Z",
        "end": "2026-09-14T11:32:36.000Z",
        "count": 31
      },
      {
        "start": "2026-09-14T11:32:36.000Z",
        "end": "2026-09-14T14:32:36.000Z",
        "count": 26
      },
      {
        "start": "2026-09-14T14:32:36.000Z",
        "end": "2026-09-14T17:32:36.000Z",
        "count": 33
      },
      {
        "start": "2026-09-14T17:32:36.000Z",
        "end": "2026-09-14T20:32:36.000Z",
        "count": 28
      },
      {
        "start": "2026-09-14T20:32:36.000Z",
        "end": "2026-09-14T23:32:36.000Z",
        "count": 25
      },
      {
        "start": "2026-09-14T23:32:36.000Z",
        "end": "2026-09-15T02:32:36.000Z",
        "count": 17
      },
      {
        "start": "2026-09-15T02:32:36.000Z",
        "end": "2026-09-15T05:32:36.000Z",
        "count": 17
      },
      {
        "start": "2026-09-15T05:32:36.000Z",
        "end": "2026-09-15T08:32:36.000Z",
        "count": 21
      }
    ]
  },
  "events": [
    {
      "id": "ci41333055",
      "magnitude": 1.1,
      "place": "5 km SW of Brawley, CA",
      "occurredAt": "2026-09-15T08:28:04.590Z",
      "updatedAt": "2026-09-15T08:30:07.109Z",
      "latitude": 32.9475,
      "longitude": -115.5653,
      "depthKm": 2.3,
      "tsunami": false,
      "significance": 19,
      "felt": null,
      "alert": null,
      "status": "automatic",
      "url": "https://earthquake.usgs.gov/earthquakes/eventpage/ci41333055"
    },
    {
      "id": "ci41333039",
      "magnitude": 1,
      "place": "20 km NNW of Searles Valley, CA",
      "occurredAt": "2026-09-15T08:13:50.940Z",
      "updatedAt": "2026-09-15T08:15:53.460Z",
      "latitude": 35.9393,
      "longitude": -117.4738,
      "depthKm": 3.1,
      "tsunami": false,
      "significance": 16,
      "felt": null,
      "alert": null,
      "status": "automatic",
      "url": "https://earthquake.usgs.gov/earthquakes/eventpage/ci41333039"
    },
    {
      "id": "nc75435977",
      "magnitude": 0.8,
      "place": "6 km W of Cobb, CA",
      "occurredAt": "2026-09-15T08:13:12.610Z",
      "updatedAt": "2026-09-15T08:14:50.364Z",
      "latitude": 38.8232,
      "longitude": -122.7902,
      "depthKm": 0.7,
      "tsunami": false,
      "significance": 9,
      "felt": null,
      "alert": null,
      "status": "automatic",
      "url": "https://earthquake.usgs.gov/earthquakes/eventpage/nc75435977"
    },
    {
      "id": "nc75435972",
      "magnitude": 0.7,
      "place": "8 km WNW of Cobb, CA",
      "occurredAt": "2026-09-15T08:06:23.710Z",
      "updatedAt": "2026-09-15T08:08:00.306Z",
      "latitude": 38.8387,
      "longitude": -122.8077,
      "depthKm": 2,
      "tsunami": false,
      "significance": 8,
      "felt": null,
      "alert": null,
      "status": "automatic",
      "url": "https://earthquake.usgs.gov/earthquakes/eventpage/nc75435972"
    },
    {
      "id": "aka2026shhrds",
      "magnitude": 1.7,
      "place": "74 km WSW of Nanwalek, Alaska",
      "occurredAt": "2026-09-15T08:00:55.876Z",
      "updatedAt": "2026-09-15T08:02:27.914Z",
      "latitude": 59.134,
      "longitude": -153.154,
      "depthKm": 80.2,
      "tsunami": false,
      "significance": 44,
      "felt": null,
      "alert": null,
      "status": "automatic",
      "url": "https://earthquake.usgs.gov/earthquakes/eventpage/aka2026shhrds"
    },
    {
      "id": "aka2026shhoai",
      "magnitude": 1.3,
      "place": "38 km WNW of Four Mile Road, Alaska",
      "occurredAt": "2026-09-15T07:57:25.483Z",
      "updatedAt": "2026-09-15T08:00:47.204Z",
      "latitude": 64.779,
      "longitude": -149.822,
      "depthKm": 5,
      "tsunami": false,
      "significance": 26,
      "felt": null,
      "alert": null,
      "status": "automatic",
      "url": "https://earthquake.usgs.gov/earthquakes/eventpage/aka2026shhoai"
    },
    {
      "id": "aka2026shhkyr",
      "magnitude": 1.5,
      "place": "31 km WNW of Beluga, Alaska",
      "occurredAt": "2026-09-15T07:53:53.488Z",
      "updatedAt": "2026-09-15T07:56:18.725Z",
      "latitude": 61.224,
      "longitude": -151.643,
      "depthKm": 84.3,
      "tsunami": false,
      "significance": 35,
      "felt": null,
      "alert": null,
      "status": "automatic",
      "url": "https://earthquake.usgs.gov/earthquakes/eventpage/aka2026shhkyr"
    },
    {
      "id": "aka2026shhhvs",
      "magnitude": 2.6,
      "place": "134 km ENE of Anaktuvuk Pass, Alaska",
      "occurredAt": "2026-09-15T07:50:18.535Z",
      "updatedAt": "2026-09-15T08:09:36.789Z",
      "latitude": 68.608,
      "longitude": -148.715,
      "depthKm": 5,
      "tsunami": false,
      "significance": 104,
      "felt": null,
      "alert": null,
      "status": "automatic",
      "url": "https://earthquake.usgs.gov/earthquakes/eventpage/aka2026shhhvs"
    },
    {
      "id": "tx2026seilfz",
      "magnitude": 1.8,
      "place": "63 km S of Whites City, New Mexico",
      "occurredAt": "2026-09-15T07:26:49.532Z",
      "updatedAt": "2026-09-15T07:34:56.830Z",
      "latitude": 31.607,
      "longitude": -104.369,
      "depthKm": 4.1,
      "tsunami": false,
      "significance": 50,
      "felt": null,
      "alert": null,
      "status": "automatic",
      "url": "https://earthquake.usgs.gov/earthquakes/eventpage/tx2026seilfz"
    },
    {
      "id": "nc75435962",
      "magnitude": 3.3,
      "place": "17 km WSW of Petrolia, CA",
      "occurredAt": "2026-09-15T07:18:06.510Z",
      "updatedAt": "2026-09-15T07:52:20.918Z",
      "latitude": 40.2935,
      "longitude": -124.485,
      "depthKm": 9,
      "tsunami": false,
      "significance": 166,
      "felt": null,
      "alert": null,
      "status": "automatic",
      "url": "https://earthquake.usgs.gov/earthquakes/eventpage/nc75435962"
    },
    {
      "id": "ci41333031",
      "magnitude": 1.4,
      "place": "5 km SSE of Loma Linda, CA",
      "occurredAt": "2026-09-15T07:15:31.330Z",
      "updatedAt": "2026-09-15T07:25:44.050Z",
      "latitude": 34.008,
      "longitude": -117.2338,
      "depthKm": 16.7,
      "tsunami": false,
      "significance": 31,
      "felt": null,
      "alert": null,
      "status": "automatic",
      "url": "https://earthquake.usgs.gov/earthquakes/eventpage/ci41333031"
    },
    {
      "id": "nc75435957",
      "magnitude": 2,
      "place": "14 km W of Petrolia, CA",
      "occurredAt": "2026-09-15T07:10:40.740Z",
      "updatedAt": "2026-09-15T07:47:25.888Z",
      "latitude": 40.3105,
      "longitude": -124.4463,
      "depthKm": 9.9,
      "tsunami": false,
      "significance": 59,
      "felt": null,
      "alert": null,
      "status": "automatic",
      "url": "https://earthquake.usgs.gov/earthquakes/eventpage/nc75435957"
    },
    {
      "id": "nc75435952",
      "magnitude": 1,
      "place": "8 km NW of The Geysers, CA",
      "occurredAt": "2026-09-15T06:52:25.700Z",
      "updatedAt": "2026-09-15T07:22:22.711Z",
      "latitude": 38.8347,
      "longitude": -122.8173,
      "depthKm": 1.9,
      "tsunami": false,
      "significance": 17,
      "felt": null,
      "alert": null,
      "status": "automatic",
      "url": "https://earthquake.usgs.gov/earthquakes/eventpage/nc75435952"
    },
    {
      "id": "nc75435947",
      "magnitude": 1.3,
      "place": "7 km W of Cobb, CA",
      "occurredAt": "2026-09-15T06:36:27.790Z",
      "updatedAt": "2026-09-15T08:12:20.060Z",
      "latitude": 38.8315,
      "longitude": -122.7997,
      "depthKm": 2.2,
      "tsunami": false,
      "significance": 24,
      "felt": null,
      "alert": null,
      "status": "automatic",
      "url": "https://earthquake.usgs.gov/earthquakes/eventpage/nc75435947"
    },
    {
      "id": "nc75435942",
      "magnitude": 0.4,
      "place": "2 km N of The Geysers, CA",
      "occurredAt": "2026-09-15T06:25:16.440Z",
      "updatedAt": "2026-09-15T07:17:23.681Z",
      "latitude": 38.7948,
      "longitude": -122.7595,
      "depthKm": 1.2,
      "tsunami": false,
      "significance": 3,
      "felt": null,
      "alert": null,
      "status": "automatic",
      "url": "https://earthquake.usgs.gov/earthquakes/eventpage/nc75435942"
    },
    {
      "id": "pr71531828",
      "magnitude": 2.9,
      "place": "5 km E of La Parguera, Puerto Rico",
      "occurredAt": "2026-09-15T06:21:48.340Z",
      "updatedAt": "2026-09-15T06:52:50.860Z",
      "latitude": 17.9715,
      "longitude": -66.9962,
      "depthKm": 13.2,
      "tsunami": false,
      "significance": 126,
      "felt": null,
      "alert": null,
      "status": "reviewed",
      "url": "https://earthquake.usgs.gov/earthquakes/eventpage/pr71531828"
    },
    {
      "id": "aka2026shedez",
      "magnitude": 1.5,